Keyword,Volume,Keyword Difficulty,CPC (USD),Competitive Density,Number of Results,Intent,SERP Features,Trend
mi movistar factura consumo y servicios movistar,210,39,0.36,0.00,81,"Navigational, Transactional","Reviews, Site links, Video, People also ask","0.53,0.65,0.43,0.81,1.00,0.43,0.65,0.43,0.81,0.65,1.00,1.00"
másmóvil es ayuda clientes factura y consumo,170,27,0.34,0.29,97,"Informational, Transactional","Reviews, Site links, Video, People also ask","0.09,0.36,0.36,0.09,0.09,0.81,0.23,0.09,0.06,0.06,0.05,0.05"
consum facturación,140,25,0.00,0.01,1350000,"Informational, Transactional","Reviews, Video, People also ask","0.01,0.01,0.54,0.01,0.44,0.23,1.00,0.23,0.03,0.00,0.23,0.23"
mi movistar facturas y consumo,140,33,0.00,0.01,100,"Navigational, Transactional","Reviews, Site links, Video","0.42,0.53,0.53,0.65,0.65,0.65,0.42,0.65,0.53,0.53,0.26,0.42"
movistar facturas y consumo,140,33,2.40,0.03,148000,"Navigational, Transactional","Reviews, Site links, Video, People also ask","0.43,0.43,0.43,0.34,0.28,0.28,0.28,0.43,0.28,0.34,0.65,0.65"
consum facturas,110,30,0.00,0.01,66100,"Navigational, Transactional","Reviews, Site links, Image pack","0.03,0.03,0.34,0.03,1.00,0.65,0.65,0.43,0.06,0.34,0.43,0.43"
movistar canal cliente consumo y facturas,110,44,0.00,0.00,88,"Navigational, Transactional","Reviews, Site links, Video","0.52,0.64,0.82,0.82,0.64,0.64,0.64,0.82,1.00,0.52,0.52,0.52"
